{
  "schema_version": "1.0",
  "beraternummer": "413885",
  "mandantennummer": "10000",
  "abrechnungsmonat": "2026-09",
  "personalnummer_typ": "datev",
  "korrekturmodus": "original",
  "zuordnungsnachweis": "Synthetisches Formatbeispiel; keine Zuordnung zu einem echten Mandanten.",
  "datensaetze": [
    {
      "personalnummer": "00001",
      "lohnart": "2000",
      "wert": "2500.00",
      "werteinheit": "betrag",
      "bemerkung": "Mustervergütung",
      "quelle": "Synthetisches Beispiel: Monatswert"
    },
    {
      "personalnummer": "00002",
      "kalendertag": "14",
      "ausfallschluessel": "U",
      "stunden": "4.00",
      "tage": "0.50",
      "quelle": "Synthetisches Beispiel: halber Urlaubstag"
    }
  ]
}
